{"$schema":"https://json-schema.org/draft/2020-12/schema","description":"Order payload from the site configurator. The separate PCB designer app fills keyboard.designer_export; the site does not need to understand it, only carry it through to fabrication.","properties":{"accessories":{"items":{"type":"string"},"type":"array"},"case":{"enum":["vintage","sleek","tactical","hidden","exposed","luggable"],"type":"string"},"compute":{"enum":["pi5","orin","byo"],"type":"string"},"display":{"enum":["7","10","13","none"],"type":"string"},"estimate_usd":{"type":"number"},"form":{"enum":["foldable","slab","typewriter","luggable","split","book"],"type":"string"},"keyboard":{"properties":{"board":{"enum":["SB-40","SB-50","SB-60","SB-65","SB-75","SB-Ortho48","SB-Split36","SB-Type","SB-Track","SB-Macro"],"type":"string"},"designer_export":{"description":"Opaque payload from the separate PCB designer app: board outline, key placements, keymap. Validated by that app, carried through here unchanged.","type":"object"},"keycaps":{"enum":["low","chunky","vintage","blank"],"type":"string"},"switches":{"type":"string"},"touchpad":{"enum":["none","side","center","trackball","stick"],"type":"string"}},"required":["board","touchpad","keycaps"],"type":"object"},"notes":{"type":["string","null"]},"product":{"const":"south-bay-cyber-deck","type":"string"},"version":{"const":1,"type":"integer"}},"required":["version","product","compute","case","form","keyboard"],"title":"South Bay Cyber Deck Build Config","type":"object"}