{"accessories":["esp32lcd","esp32second","wifi","gps","battery"],"case":"tactical","compute":"orin","display":"10","estimate_usd":1890,"form":"luggable","keyboard":{"board":"SB-65","keycaps":"chunky","switches":"tactile, quiet-ish","touchpad":"trackball"},"notes":"Example build only — field deck, Orin Nano for on-device AI, trackball for gloves, extra battery.","product":"south-bay-cyber-deck","version":1}