{"accessories":["esp32lcd","lora"],"case":"vintage","compute":"pi5","display":"10","estimate_usd":1220,"form":"typewriter","keyboard":{"board":"SB-Type","keycaps":"vintage","switches":"tactile, chunky","touchpad":"none"},"notes":"Example build only — beige wedge, round caps, LoRa + status LCD.","product":"south-bay-cyber-deck","version":1}